{
  "schema": "bead-close-evidence/v1", "repo": "oraclemcp", "generated_at": "2026-09-17T06:00:00Z", "bead_id": "oraclemcp-xoflp.5.16",
  "scope": {"summary": "Doctor legacy audit migration streams through authenticated descriptors with bounded memory.", "in_scope": ["crates/oraclemcp-core/src/doctor.rs"], "out_of_scope": ["Normal audit runtime append behavior." ]},
  "source": {"sha": "31ac3fe3f9024844742aee2d413a3cba1a910d82", "tree_clean": true, "branch": "main"}, "proofs": [],
  "integration_evidence": {"entry_points": [{"name": "doctor legacy-state migration", "kind": "cli", "trace": "Fix 5fc6b8cfc9eb306c587d84c24083d421665942cd; regressions legacy_migration_streams_a_large_audit_to_byte_identical_outputs and legacy_migration_refuses_source_swap_before_any_copy. GrayKite convergence PASS, thread oraclemcp-xoflp.5.34 message 2352."}]},
  "live_evidence": {"claimed": false, "artifacts": []}, "limitations": ["Offline migration fixtures only."], "known_defects": [], "follow_ups": [], "readiness": {"claim": "not-ready", "basis": "scoped-test"}
}
