{
  "schema": "bead-close-evidence/v1",
  "repo": "oraclemcp",
  "generated_at": "2026-09-23T17:00:00Z",
  "bead_id": "oraclemcp-k-server-test-evidence-schema-threat-model-3eyx",
  "scope": {
    "summary": "RETIRED: operator ruling 2026-09-23: process-only (R18/R24) (Design test-evidence vN and its threat model)",
    "in_scope": [
      "CHANGELOG.md"
    ],
    "out_of_scope": [
      "No implementation work is claimed by this close."
    ]
  },
  "source": {
    "sha": "f0ff72b5f729aded473c0a90736d7c666ad983ed",
    "tree_clean": true,
    "branch": "main"
  },
  "proofs": [],
  "integration_evidence": {
    "entry_points": [],
    "entry_points_excluded_reason": "retired-no-runtime-surface"
  },
  "live_evidence": {
    "claimed": false,
    "artifacts": []
  },
  "limitations": [
    "Retired, not implemented: Design test-evidence vN and its threat model. operator ruling 2026-09-23: process-only (R18/R24). Listed in PLAN_0_12_0 plan v3 (R29/R30): process-only deferred beads retired."
  ],
  "known_defects": [],
  "follow_ups": [],
  "readiness": {
    "claim": "not-ready",
    "basis": "manual-review"
  }
}
