{"schema":"bead-close-evidence/v1","repo":"oraclemcp","generated_at":"2026-09-17T06:00:00Z","bead_id":"oraclemcp-xoflp.5.28","scope":{"summary":"WORM mirror opening rejects a matching tail with a tampered signature.","in_scope":["crates/oraclemcp-audit/src/shipping.rs"],"out_of_scope":["Spool replacement detection, tracked by oraclemcp-xoflp.5.27."]},"source":{"sha":"31ac3fe3f9024844742aee2d413a3cba1a910d82","tree_clean":true,"branch":"main"},"proofs":[],"integration_evidence":{"entry_points":[{"name":"WORM mirror open","kind":"api","trace":"Fix e497109c8bb00ea023ddfd4a6a5d4bbd845aba84; regression worm_open_rejects_a_matching_tail_with_a_tampered_signature. GrayKite convergence PASS, thread oraclemcp-xoflp.5.34 message 2352."}]},"live_evidence":{"claimed":false,"artifacts":[]},"limitations":["Offline signed-mirror fixture coverage only."],"known_defects":[],"follow_ups":[],"readiness":{"claim":"not-ready","basis":"scoped-test"}}
